{
  "$schema": "../spec/jist-theme-schema.json",
  "heading": {
    "text": { "fontSize": 15, "fontWeight": 600, "color": "#1A1A2E" },
    "h4": {
      "text": { "fontSize": 14, "fontWeight": 600 }
    }
  },
  "text": {
    "text": { "fontSize": 13, "color": "#4A4A68", "maxLines": 3 }
  },
  "date": {
    "text": { "fontSize": 12, "color": "#8E8EA0" }
  },
  "button": {
    "text": { "color": "#FFFFFF", "fontSize": 13, "fontWeight": 500 },
    "background": { "color": "#4F46E5" },
    "border": { "radius": 6 },
    "padding": { "top": 7, "right": 14, "bottom": 7, "left": 14 },
    "states": {
      "hover": { "background": { "color": "#4338CA" } },
      "active": { "background": { "color": "#3730A3" } }
    },
    "secondary": {
      "text": { "color": "#4A4A68" },
      "background": { "color": "#F4F4F6" },
      "border": { "width": 1, "color": "#E2E2E8", "radius": 6 },
      "states": {
        "hover": { "background": { "color": "#E8E8EE" } },
        "active": { "background": { "color": "#DDDDE5" } }
      }
    }
  },
  "modes": {
    "dark": {
      "heading": {
        "text": { "color": "#F0F0F5" }
      },
      "text": {
        "text": { "color": "#B0B0C0" }
      },
      "date": {
        "text": { "color": "#707088" }
      },
      "button": {
        "background": { "color": "#6366F1" },
        "states": {
          "hover": { "background": { "color": "#5558E8" } },
          "active": { "background": { "color": "#4F46E5" } }
        },
        "secondary": {
          "text": { "color": "#C0C0D0" },
          "background": { "color": "#2A2A3C" },
          "border": { "color": "#3A3A4C" },
          "states": {
            "hover": { "background": { "color": "#333346" } },
            "active": { "background": { "color": "#3A3A50" } }
          }
        }
      }
    }
  }
}
